"id","user_id","book_id","style_rating","content_rating","pleasantness_rating","originality_rating","edition_rating","average_rating","general_comment","style_comment","content_comment","pleasantness_comment","originality_comment","edition_comment"
"1","fra","1","1","1","1","1","1","1","Opera superficiale che non aggiunge nulla al panorama letterario attuale.","Stile troppo verboso e prolisso, spesso si perde in descrizioni non necessarie.","Personaggi stereotipati e poco sviluppati, difficile immedesimarsi in loro.","Lettura faticosa che procede a stento, ho dovuto sforzarmi per arrivare alla fine.","Trama che ricalca quella di opere molto più note senza aggiungere nulla di nuovo.","Troppi refusi e errori di battitura, sembra che manchi una revisione editoriale."
"2","luca","140","2","3","2","1","2","2","Un libro che promette molto ma mantiene poco, lascia un senso di incompiutezza.","La scrittura è piatta e monotona, senza variazioni di ritmo o tono.","Troppe sottotrame che vengono lasciate irrisolte senza un motivo apparente.","Atmosfera costantemente cupa e deprimente, senza nessun momento di sollievo.","L'autore utilizza tutti i più comuni espedienti narrativi senza mai sorprendere.","Font troppo piccolo e spaziatura ridotta che affaticano la vista."
"3","luca","1","1","1","1","1","1","1","Non mi ha lasciato nulla, una lettura dimenticabile.","Troppi errori grammaticali e sintattici che distraggono dalla lettura.","Le tematiche trattate sono superficiali e manca profondità nel loro sviluppo.","Atmosfera costantemente cupa e deprimente, senza nessun momento di sollievo.","Sembra un collage di idee già viste, senza alcun elemento di novità.","Troppi refusi e errori di battitura, sembra che manchi una revisione editoriale."
"4","ale","1","5","5","5","5","4","4.8",""Esperienza di lettura completa ed appagante, che lascia un segno.","Stile elegante e sofisticato che riesce a trasmettere perfettamente le emozioni dei personaggi.","Affronta tematiche profonde in modo intelligente e mai didascalico.","La lettura scorre veloce e piacevole, un'esperienza davvero godibile.","Miscela generi diversi in modo coerente, creando qualcosa di unico.","Traduzione impeccabile che riesce a mantenere lo spirito dell'opera originale."
"5","ale","140","2","4","3","4","5","3.6",""Esperienza di lettura completa ed appagante, che lascia un segno.","Dialoghi artificiosi che non rispecchiano il modo in cui le persone parlano realmente.","L'ambientazione è descritta in modo così vivido che diventa quasi un personaggio della storia.","Non sono riuscito a provare empatia per nessun personaggio, rendendo difficile interessarmi alla loro sorte.","NULL","Traduzione impeccabile che riesce a mantenere lo spirito dell'opera originale."
"6","fra","140","2","2","2","3","2","2.2","Un'occasione persa: le premesse erano interessanti ma lo sviluppo deludente.",""Abuso di aggettivi e avverbi che appesantiscono inutilmente la lettura.","Trama prevedibile con soluzioni banali ai conflitti presentati.","L'eccesso di violenza gratuita rende la lettura sgradevole e disturbante.","Segue pedissequamente tutte le convenzioni del genere senza mai osare","Traduzione approssimativa che perde molte delle sfumature del testo originale."
"7","ale","14","4","5","4","5","4","4.4","Uno dei migliori libri che ho letto quest'anno, lo consiglio vivamente.","La prosa è fluida e scorrevole, un vero piacere da leggere.","La storia offre spunti di riflessione che rimangono anche dopo aver chiuso il libro.","Nonostante la complessità dei temi trattati, la lettura risulta sempre leggera e coinvolgente.","Un approccio completamente nuovo a un genere consolidato, una vera ventata di freschezza","Copertina elegante che rappresenta perfettamente l'essenza del libro"
"8","ale","10","5","5","3","2","3","3.6","Opera che sa bilanciare perfettamente intrattenimento e profondità.","Eccellente uso dei dialoghi, realistici e capaci di definire i personaggi.","Personaggi complessi e ben sviluppati, con motivazioni credibili.","Nonostante la complessità dei temi trattati, la lettura risulta sempre leggera e coinvolgente.","Sembra un collage di idee già viste, senza alcun elemento di novità.","Traduzione approssimativa che perde molte delle sfumature del testo originale."
"9","fra","14489","5","5","4","4","5","4.6","Un'opera che merita di essere letta e riletta, ogni volta si scoprono nuovi dettagli.","L'autore ha una voce unica e riconoscibile, con un ritmo narrativo che mantiene alta l'attenzione.","Trama avvincente con colpi di scena ben orchestrati e mai forzati.","Un libro che ti cattura fin dalle prime pagine, impossibile metterlo giù.","Un approccio completamente nuovo a un genere consolidato, una vera ventata di freschezza","Copertina elegante che rappresenta perfettamente l'essenza del libro"